id,tittle,content
17,"['Thị giá tăng 144%, vốn hóa Sunshine Homes (SSH) gần chạm ngưỡng 600 triệu USD chỉ sau 5 phiên lên sàn']","['Chốt phiên giao dịch 10/8, cổ phiếu SSH của CTCP Phát triển Sunshine Homes tăng kịch biên độ 14,8%, đưa thị giá lên mức 52.600 đồng/đơn vị. Tại mức giá này, với 250 triệu cổ phiếu đang lưu hành, vốn hoá thị trường của Sunshine Homes đã đạt mức 13.150 tỷ đồng (~572 triệu USD), vượt mặt hàng loạt “lão làng” trong ngành BĐS như FLC, DIG, TCH...\nCổ phiếu SSH bắt đầu giao dịch trên sàn UPCoM vào phiên 4/8, tính đến nay đã giao dịch được 5 phiên. Đây cũng là 5 phiên liên tiếp ghi nhận thị giá ""đội trần""; so với mức giá tham chiếu phiên đầu tiên là 21.600 đồng/cổ phiếu, thị giá SSH đã tăng 144%. \nMặc dù giá trị cổ phiếu liên tục bứt phá như vậy, song thanh khoản SSH lại rất thấp khi chỉ từ 500 - 1.000 cổ phiếu được khớp lệnh mỗi phiên. Cụ thể trong phiên giao dịch 10/8, chỉ có 1.000 cổ phiếu được khớp lệnh, trong khi dư mua tại mức giá trần ghi nhận gần 1,4 triệu đơn vị.\nSSH hoạt động trong lĩnh vực BĐS phân khúc cao cấp với 4 dòng sản phẩm chính là căn hộ hạng sang (Shunshine Apartment), biệt thự thấp tầng (Shunshine Villas), biệt thự trên không (Shunshine Sky Villas) và văn phòng trung tâm thương mại cho thuê.\nBên cạnh đó, SSH cũng đang hướng đến việc phát triển thêm nhiều các dự án bất động sản công nghiệp, các đại đô thị thông minh - Smart City với khát vọng định hình và thay đổi diện mạo, mang đến chuẩn đô thị mới với tâm điểm là các công dân điện tử, trong xu thế số hoá đang ngày càng trở thành tất yếu.\nKết quả kinh doanh 6 tháng đầu năm 2021 được SSH công bố trước khi chào sàn UPCoM ghi nhận sự bứt phá mạnh mẽ. Doanh thu đạt gần 990 tỷ đồng và lợi nhuận sau thuế đạt 145 tỷ, trong khi cùng kỳ lỗ gần 7 tỷ đồng. Biên lợi nhuận gộp được cải thiện từ 25% lên 36%. Tính tới 30/6/2021, tổng tài sản của SSH tăng 25% so với đầu năm lên mức 12.540 tỷ đồng.\nBước sang năm 2021, kế hoạch đề ra doanh thu và lợi nhuận sau thuế lần lượt là 2.000 tỷ đồng và 300 tỷ đồng. Còn đến năm 2022, SSH đặt chỉ tiêu doanh thu và lãi ròng là 3.000 tỷ đồng và 450 tỷ đồng; đồng thời dự kiến sẽ bắt đầu chi trả cổ tức với tỷ lệ 10%.\nVề cơ cấu cổ đông, tính đến 1/7/202, Công ty CP Phát triển Sunshine Homes gồm có 131 cổ đông, toàn bộ là cổ đông trong nước. Trong đó bao gồm 2 cổ đông lớn nắm giữ 71% cổ phần, các cổ đông khác nắm giữ 29% còn lại.  \nTính đến 30/6/2021, SSH sở hữu ba công ty con - liên kết đều hoạt động trong lĩnh vực kinh doanh BĐS.']"
18,"['Ảnh hưởng của dịch bệnh, nhiều doanh nghiệp ngành bia rượu báo lãi quý 2/2021 giảm sút so với cùng kỳ']","['Quý 2/2021 kết thúc trong thời điểm cả nước đang căng mình chống đợt dịch Covid-19 bùng phát. Do vậy, hầu hết các doanh nghiệp ngành bia, rượu sẽ gặp khó khăn do tình hình tiêu thụ, do ảnh hưởng của các lệnh giãn cách, hạn chế tụ tập.\nSabeco và Habeco đồng loạt sụt giảm lợi nhuận\nÔng lớn Sabeco (SAB) báo cáo doanh thu hợp nhất quý 2/2021 đạt 7.272 tỷ đồng, đi ngang so với cùng kỳ. Tuy nhiên chi phí bán hàng tăng mạnh nên lợi nhuận sau thuế còn 1.071 tỷ đồng, giảm 12% so với cùng kỳ.\nLũy kế 6 tháng đầu năm 2021 doanh thu đạt 13.165 tỷ đồng, tăng 9% so với nửa đầu năm ngoái. Khấu trừ hết chi phí, Sabeco còn lãi sau thuế 2.057 tỷ đồng, tăng 6% so với cùng kỳ.\nTheo Sabeco, Công ty đã thực hiện nhiều giải pháp toàn diện để tối ưu việc quản lý kinh doanh và tiếp tục đẩy mạnh các hoạt động bán hàng, từ đó góp phần giảm thiểu ảnh hưởng từ làn sóng thứ 3 và thứ 4 của đại dịch Covid-19, nâng cao hiệu quả kinh doanh. Báo cáo ghi nhận, tổng chi phí quảng cáo và khuyến mại 6 tháng đầu năm 2021 của công ty tăng 62% so với cùng kỳ, lên 1.246 tỷ đồng. Thực trạng cho thấy chiến dịch gia tăng quảng cáo, khuyến mại đã giúp doanh thu và lợi nhuận của công ty tăng.\nChiếm lĩnh thị phần miền Bắc, Habeco (BHN) cũng kết thúc quý 2 với lợi nhuận giảm sút so với cùng kỳ. Cụ thể, doanh thu thuần đạt 1.936 tỷ đồng, giảm 9% so với quý 2/2020. Cũng do chi phí bán hàng tăng dẫn đến lợi nhuận sau thuế giảm 26% so với cùng kỳ, còn 182 tỷ đồng. Habeco cho biết, chi phí bán hàng tăng chủ yếu do chi phí quảng cáo, khuyến mại, hỗ trợ và chi phí khác. Điều này phù hợp với kế hoạch tập trung nguồn lực vào các chương trình khuyến mại đã được cổ đông Habeco thông qua tại cuộc họp ĐHCĐ thường niên 2021 vừa qua.\nLũy kế 6 tháng đầu năm 2021 Habeco đạt 3.312 tỷ đồng doanh thu thuần và 230 tỷ đồng LNST, vẫn lần lượt tăng 15% và 58% so với cùng kỳ.\nHalico (HNR) tiếp tục thua lỗ\nSau quý 1 có vẻ khởi sắc với số lỗ chỉ 1 tỷ đồng, doanh thu tăng đột biến 34% lên gần 36 tỷ đồng khiến nhà đầu tư chú ý thì quý 2 ""đâu lại vào đó"". Doanh thu quý 2 tiếp tục giảm 37% so với cùng kỳ, còn hơn 17,2 tỷ đồng và lỗ tiếp 12,3 tỷ đồng, gần gấp đôi so với số lỗ 6,5 tỷ đồng quý 2 năm ngoái. Tính chung 6 tháng đầu năm 2021 Halico lỗ 13,3 tỷ đồng, nâng tổng lỗ lũy kế chưa phân phối lên 458 tỷ đồng.\nTrên thực tế, ảnh hưởng của dịch bệnh, của các lệnh hạn chế tụ tập, tiếp xúc, hạn chế việc tổ chức tiệc tùng mỗi lần bùng phát dịch, cùng với mức phạt đủ sức răn đe đối với việc uống rượu bia khi lái xe đã khiến sức mua giảm. Cộng với đó quý 2 là quý bước vào mùa nóng tại Việt Nam, lượng tiêu thụ rượu giảm sút so với quý 1 cũng không lạ.\nNhiều doanh nghiệp ngành bia vẫn báo lãi tăng trưởng\nNgoài 2 ông lớn Sabeco và Habeco, và cồn rượu Halico, hầu hết các doanh nghiệp bia rượu khác trên sàn đều là công ty con, liên doanh liên kết có liên quan đến các sản phẩm mang thương hiệu của Bia Sài Gòn hoặc Bia Hà Nội.\nPhần lớn các doanh nghiệp ngành bia khác cũng báo lãi quý 2 tăng trưởng so với cùng kỳ như Bia Sài Gòn Miền Tây (WSB), như Bia Sài Gòn Phú Thọ (BSP), Bia Sài Gòn Sông Lam (BSL), Bia Sài Gòn Miền Trung (SMB) hay lợi nhuận đi ngang như Bia Sài Gòn Quảng Ngãi (BSQ).\nCá biệt có doanh nghiệp báo lãi quý 2 giảm sút so với cùng kỳ như Bia Hà Nội Hải Dương 9HAD). Hay những doanh nghiệp báo lỗ như cùng kỳ như Bia Hà Nội Quảng Bình (BQB), như Bia Sài Gòn Bạc Liêu (SBL).\nSSI Research: Ngành bia phải đến năm 2022 mới hồi phục hoàn toàn, 2 ""ông lớn"" Sabeco và Heineken vẫn miệt mài ""chạy đua""']"
19,['Một lãnh đạo của VLXD Bình Dương quyết tâm chi trăm tỷ mua thêm hơn chục triệu cổ phiếu MVC'],"['Bà Phạm Kim Oanh, Ủy viên HĐQT CTCP Vật liệu xây dựng Bình Dương (mã chứng khoán MVC) thông báo đăng ký mua thêm 10,5 triệu cổ phiếu MVC để gia tăng tỷ lệ sở hữu. Giao dịch dự kiến thực hiện từ 12/8 đến 10/9/2021.\nHiện bà Kim Oanh đang là cổ đông lớn sở hữu 14,4 triệu cổ phiếu MVC.\nĐây cũng không phải là lần đầu bà Oanh đăng ký mua số cổ phiếu này. Trước đó bà Kim Oanh đăng ký mua đúng 10,5 triệu cổ phiếu MVC giai đoạn từ 30/6 đến 27/7/2021. Tuy vậy hết thời gian đăng ký bà Oanh vẫn không mua được cổ phiếu nào.\nThời điểm bà Oanh đăng ký mua, cổ phiếu MVC giao dịch quanh mức 9.600 đồng/cổ phiếu, tương ứng bà Kim Oanh dự kiến chi khoảng trăm tỷ đồng cho dự kiến tăng tỷ lệ sở hữu này. Bà Kim Oanh thông báo nguyên nhân không mua được số cổ phiếu đăng ký là do diễn biến giá trên thị trường không như kỳ vọng.\nADVERTISING\niTVC from Admicro\nCòn trên thực tế, hiện cổ phiếu MVC đã giảm, thậm chí trước đó còn xuống dưới ngưỡng 8.000 đồng/cổ phiếu trước khi tăng trở lại lên vùng giá 9.100 đồng/cổ phiếu như hiện nay.\nCũng liên quan đến các giao dịch cổ phiếu MVC, trước đó ông Nguyễn Thành Nhân – cũng là Ủy viên HĐQT của VLXD Bình Dương - đăng ký bán toàn bộ gần 24 triệu cổ phiếu MVC (tỷ lệ 23,95%). Giao dịch cũng dự kiến thực hiện cùng đợt với lần đăng ký mua trước đó của bà Kim Oanh – từ 29/6 đến 27/7/2021. Và ông Thành Nhân cũng chưa bán được số cổ phiếu này. Hiện chưa có thông tin ông Nhân lại tiếp tục mang cổ phiếu ra bán.\nCơ cấu cổ đông của VLXD Bình Dương hiện tại có Tổng Công ty Thanh Lễ là cổ đông lớn nhất sở hữu 25 triệu cổ phần. Cổ đông lớn thứ 2 chính là ông Nguyễn Thành Nhân – người vừa quyết định mang toàn bộ cổ phần ra bán; ngoài ra có hai cổ đông lớn khác là bà Oanh với tỷ lệ sở hữu 14,4% vốn và ông Nguyễn Xuân Thuận với lượng nắm giữ 9,6% vốn.\nỦy viên HĐQT VLXD Bình Dương muốn chi hơn 100 tỷ mua cổ phiếu MVC']"
20,"['Thị giá 160.000 đồng/cp, Digiworld (DGW) chốt quyền nhận cổ tức bằng tiền và phát hành cổ phiếu thưởng tổng tỷ lệ 110%']","['Ngày 23/8 tới đây, CTCP Thế giới số (Digiworld, Mã CK: DGW) sẽ chốt danh sách cổ đông thực hiện quyền trả cổ tức năm 2020 bằng tiền mặt đồng thời phát hành cổ phiếu thưởng từ nguồn vốn chủ sở hữu với tổng tỷ lệ 110%. Thời gian thanh toán dự kiến là 8/9/2021.\nCụ thể, Digiworld dự kiến chi trả cổ tức bằng tiền với tỷ lệ 10%, ứng với cổ đông sở hữu mỗi 1 cổ phiếu sẽ nhận được về 1.000 đồng. Ước tính với hơn 44,2 triệu cổ phiếu đang lưu hành, doanh nghiệp dự kiến chi ra khoảng 442 tỷ đồng để thanh toán cổ tức năm 2020.\nNgoài ra, trong quý 3/2021, Digiworld cũng sẽ phát hành cổ phiếu thưởng cho cổ đông hiện hữu với tỷ lệ phân bổ 1:1, đồng nghĩa cổ đông sở hữu mỗi 1 cổ phiếu được nhận về 1 cổ phiếu mới, tương đương phát hành thêm 44,2 triệu cổ phiếu.\nNguồn vốn được lấy từ phần lợi nhuận sau thuế chưa phân phối. Tại thời điểm 31/12/2020, số lợi nhuận lũy kế chưa phân phối trong BCTC ghi nhận 670 tỷ đồng. Sau phát hành, vốn điều lệ của Digiworld dự kiến tăng gấp đôi lên mức 884 tỷ đồng.\nKết quả kinh doanh năm 2021 của Digiword ghi nhận rất tích cực, doanh thu thuần đạt hơn 12.535 tỷ đồng, tăng đến 48% so với cùng kỳ năm trước. Khấu trừ các khoản chi phí, công ty đạt LNST hơn 267 tỷ đồng, tăng 64% so với thực hiện năm 2019.\nADVERTISING\niTVC from Admicro\nBước sang năm 2021, tính đến hết quý 2, dù chịu ảnh hưởng của dịch Covid-10 song Digiworld vẫn ghi nhận doanh thu thuần 4.218 tỷ đồng và lợi nhuận sau thuế 116 tỷ đồng, tăng trưởng lần lượt 63% và 142% so với cùng kỳ năm trước.\nLũy kế doanh thu thuần 6 tháng đầu năm đạt 9.225 tỷ đồng (+88%) và LNST đạt 223 tỷ (+139%). Như vậy, công ty đã hoàn thành 61% kế hoạch năm về doanh thu và 74% kế hoạch năm về LNST.\nTrên thị trường, thị giá DGW bắt đầu gia nhập câu lạc bộ ""3 chữ số"" của chứng khoán Việt từ khoảng đầu năm 2021 và vẫn đang trong đà leo dốc về giá. Chốt phiên 9/8, DGW lên đỉnh lịch sử mới 159.600 đồng/cổ phiếu, tương đương tăng 86% kể từ đầu năm 2021. Vốn hóa vượt mức 7.054 tỷ đồng.']"
21,['Đại diện Gemadept: Giá cước vận tải biển sẽ tiếp đà tăng và có thể đạt đỉnh vào quý 4/2021'],"['Dịch Covid-19 diễn biến khó lường và lan rộng ra toàn cầu, đặt cộng đồng doanh nghiệp thế giới và Việt Nam trước những nguy cơ khó lường, sự đứt gãy chuỗi cung ứng toàn cầu, tác động của việc phong tỏa, giãn cách xã hội. Trong đó, vận tải đường biển thiếu hụt container rỗng phục vụ xuất khẩu, giá cước vận tải tăng; việc vận chuyển hàng hóa đi/đến giữa các cảng/khu vực, quốc gia… gặp khó khăn đẩy giá cước liên tục tăng nóng.\nThực tế, giá cước tính đến thời điểm tháng 7/2021 đã tăng gấp hơn 7-8 lần, thậm chí hơn 10 lần so với thời điểm tháng 1/2020, cao nhất trong vòng 4 năm trở lại đây và theo các chuyên gia dự báo, giá cước vận tải biển quốc tế sẽ tiếp tục leo thang trong thời gian tới.\nĐiều này tạo động lực giúp các mã cảng biển tăng nóng từ đầu năm, thanh khoản đột biến. Chốt phiên 9/8/2021, cổ phiếu VNA (Vinaship) kịch trần tại mức 30.500 đồng/cp – cao gấp hơn 6 lần so với mức giá hồi đầu tháng 6. Không kém cạnh, HAH của Hải An cũng tăng phi mã, từ mức 17.000 đồng/cp hồi đầu năm lên 55.600 đồng/cp.\nCác mã khác như STG (Sotrans), VOS (Vosco)… cũng tăng mạnh và đồng loạt kịch trần trong phiên đầu tuần (9/8/2021), giữa bối cảnh giá cước biển leo thang lên đỉnh cao mới.\nGiá cước tăng phi mã đưa tỷ suất lợi nhuận của hãng tàu đạt đỉnh 10 năm\n""Với sự gia tăng phi mã của giá cước, các hãng tàu, đặc biệt là hãng tàu ngoài đều có lợi nhuận rất lớn trong năm 2020 và 6 tháng đầu năm 2021. Tỷ suất lợi nhuận trước thuế và lãi vay (EBIT margin) của các hãng tàu đã đạt mức cao nhất trong vòng 10 năm trở lại đây"", đại diện Gemadept (GMD) trao đổi.\nNguyên nhân theo vị này, do các hãng vận tải biển đang nắm quyền quyết định giá lớn hơn so với các chủ hàng/khách hàng xuất nhập khẩu của các hãng vận tải biển và do đó, họ đang quản lý công suất vận tải biển theo hướng tận dụng quyền kiểm soát giá này.\nNgoài ra, một số nguyên nhân khác cũng tác động như cầu tăng khi một số nước khôi phục nền kinh tế sau đại dịch, trong khi khả năng cung ứng dịch vụ bị ảnh hưởng, tắc nghẽn tại cảng Yantain, kẹt tàu tại kênh đào Suez... dẫn đến đứt gãy chuỗi cung ứng toàn cầu, thiếu hụt nghiêm trọng container rỗng.\nĐặc biệt, việc tắc nghẽn cảng biển nghiêm trọng tại Yantian (miền Nam Trung Quốc) là một trong những ví dụ điển hình của tác động từ Covid-19. Đây là một trong những cảng chuyển tải chính của khu vực, cảng tắc nghẽn khiến lịch tàu của toàn bộ hàng trung chuyển trên các tuyến chính bị xô lệch nghiêm trọng, các hãng tàu lớn phải điều chỉnh lại lịch tàu, cơ cấu lại tuyến chuyến… Hệ quả, chi phí logistics phát sinh tăng thêm đáng kể do kẹt cầu bến, kho bãi.\nNgoài ra, sự chênh lệch trong hoạt động kiểm soát dịch bệnh và phục hồi sản xuất giữa 2 khu vực Thái Bình Dương và khu vực Mỹ, EU cũng dẫn tới hiện tượng lệch cán cân thương mại.\nGiá cước có thể đạt đỉnh vào quý 4/2021\nDự báo về cơ hội của ngành đến cuối năm, đại diện Gemadept dẫn chứng từ báo cáo Chỉ số Logistics (LPI) thị trường mới nổi, cho thấy Việt Nam vào top 10 quốc gia đứng đầu và vươn lên đứng thứ 3 về chỉ số này trong số các nước ASEAN. Hội nhập kinh tế sâu rộng và việc thực thi các FTA mang đến nhiều cơ hội tăng trưởng hơn nữa cho ngành logistics của Việt Nam.\nTrong năm 2021, ngành logistics cần tập trung vào 3 vấn đề chủ yếu là: tài chính, hoạt động kinh doanh và nhân lực.\nVề giá cước, nhiều chuyên gia trong ngành dự báo giá cước sẽ tiếp tục tăng cao cho đến khi thế giới khống chế được dịch. Giá cước có thể đạt đỉnh vào quý 4/2021, sau đó sẽ điều chỉnh nhẹ vào nửa đầu năm 2022 và hạ nhiệt đáng kể vào năm 2023.\n""Ngay cả khi giá cước hạ nhiệt trở lại thì mặt bằng giá mới cũng sẽ cao hơn so với thời điểm trước khi xảy ra đại dịch Covid -19. Do đó, vai trò của các doanh nghiệp khai thác cảng và logistics sẽ đặc biệt quan trọng, nhất là trong giai đoạn hiện nay"", vị này nhấm mạnh.\nRiêng Gemadept, là công ty sở hữu hệ sinh thái tích hợp cảng - logistics lớn tại Việt Nam với chuỗi cung ứng toàn diện, ban lãnh đạo nhận thấy triển vọng tích cực từ phục hồi thương mại toàn cầu và nhu cầu giao thương hàng hóa tăng cao sau đại dịch sẽ góp phần tăng trưởng sản lượng thông quan cảng biển.\nDự báo, 6 tháng cuối năm là mùa cao điểm của ngành cảng và logistics của Gemadept khi (i) việc ký kết thêm hợp đồng với các hãng tàu; song song (ii) Việt Nam được sự báo sẽ cơ bản khống chế được dịch trong tháng 8, vì vậy kinh tế kỳ vọng sẽ hồi phục và phát triển mạnh từ tháng 9 trở đi.\nMục tiêu cho giai đoạn 2021 – 2025, Gemadept chủ trương duy trì tăng trưởng ở mức hai con số để đảm bảo đến năm 2025, Công ty tăng trưởng lợi nhuận gấp 3 lần so với thực hiện của năm 2020.\nChủ tịch Hải An (HAH) Vũ Ngọc Sơn: Giá cước vận tải vẫn ở mức cao đến cuối năm 2022, doanh nghiệp cảng biển có đủ cơ sở tiếp tục duy trì mức lợi nhuận tốt']"
22,"['Doanh nghiệp sản xuất phụ tùng cho Honda, Yamaha chốt quyền trả cổ tức bằng tiền tỷ lệ 35%']","['Ngày 19/8 tới đây, CTCP Phụ tùng máy số 1 (Mã CK: FT1) sẽ chốt danh sách cổ đông thực hiện chi trả cổ tức năm 2020 bằng tiền tỷ lệ lên tới 35%, tương ứng cổ đông sở hữu 1 cổ phiếu được nhận về 3.500 đồng. Thời gian thanh toán 20/09/2019.\nVới hơn 7 triệu cổ phiếu đang niêm yết và lưu hành, Phụ tùng máy số 1 sẽ chi xấp xỉ 25 tỷ đồng chi trả cổ tức đợt này cho cổ đông.\nPhụ tùng máy số 1 lâu nay luôn được biết đến là doanh nghiệp chủ yếu cung ứng linh kiện, phụ tùng, động cơ cho nhiều công ty như Honda, Yamaha, Atsumitec, SUMUMOTO, VMEP, PIAGGIO,… cùng với doanh nghiệp nội địa và xuất khẩu.\nBên cạnh đó, đây cũng là công ty thường xuyên chia cổ tức ở mức cao và ổn định, tỷ lệ trong các năm trước đó đều từ 32-35% bằng tiền mặt.\nADVERTISING\niTVC from Admicro\nVề kết quả kinh doanh năm 2020, Phụ tùng máy số 1 đạt hơn 750 tỷ đồng doanh thu, giảm 17% so với năm 2017. Tuy nhiên, các khoản chi phí bán hàng và chi phí quản lý doanh nghiệp đồng loạt được tiết giảm nên LNST đạt xấp xỉ 46 tỷ đồng, tăng nhẹ so với năm trước và vượt 83,6% kế hoạch đề ra. EPS cải thiện từ 4.451 đồng lên 6.485 đồng.\nBước sang năm 2021, Phụ tùng máy số 1 đề ra kế hoạch tổng doanh thu tăng 6,5% lên mức 800 tỷ đồng, tuy nhiên kỳ vọng LNST đi lùi 13% về mức 40 tỷ đồng. Cổ tức chi trả dự kiến ở mức 20%.\nHiện giá cổ phiếu FT1 đã đứng tại giá tham chiếu 50.000 đồng/cp trong khoảng 1 tháng trở lại đây. Thanh khoản dường như ""đóng băng"" khi hàng chục phiên liên tiếp không có cổ phiếu nào khớp lệnh.\nCổ phiếu FT1 dường như ""đóng băng"" về thanh khoản trong thời gian dài']"
