id,tittle,content
10,"['Bất chấp ảnh hưởng dịch Covid-19, nhiều doanh nghiệp dược vẫn lãi lớn trong nửa đầu năm 2021']","['Lợi nhuận ròng quý 2 của các doanh nghiệp ngành dược cũng như 6 tháng đầu năm 2021 có sự phân hóa rõ rệt. Không hẳn doanh nghiệp hoạt động trong ngành dược và vật tư y tế nào cũng được hưởng lợi. Trong khi phần lớn các đơn vị ""có tiếng"" giữ được vị thế và duy trì đà tăng trưởng thì nhóm công ty có quy mô nhỏ hơn lại ghi nhận lợi nhuận đi ngang thậm chí giảm sút.\nĐại dịch ập đến khiến thách thức nổi lên, hầu hết doanh nghiệp dược phải đối mặt với việc chi phí giá vốn tăng cao trong bối cảnh giá nguyên vật liệu đầu vào leo thang cùng với sự khan hiếm về nguồn cung trên thị trường. Bên cạnh đó, kênh bán thuốc qua bệnh viện (ETC) từng là động lực chính cho sự phát triển của toàn ngành cũng trở nên ""hụt hơi"" trong thời buổi dịch bệnh.\nNhững cái tên dẫn đầu về lãi ròng thu về trong quý 2 vừa qua có thể kể đến: Dược Hậu Giang (DHT, lãi 201 tỷ đồng), Pymepharco (PME, lãi 78 tỷ đồng), Traphaco (TRA, lãi 63 tỷ đồng), Imexpharm (IMP, lãi 49 tỷ đồng)…\n""Ông lớn"" Dược Hậu Giang ghi nhận doanh thu thuần quý 2 tăng trưởng 16% so với cùng kỳ năm trước lên 948 tỷ đồng. Ảnh hưởng của chi phí giá vốn tăng cao nên doanh nghiệp ghi nhận lãi ròng xấp xỉ 201 tỷ đồng, tăng 8% so với cùng kỳ. Lũy kể nửa đầu năm 2021, Dược Hậu Giang ghi nhận lãi ròng 405 tỷ đồng, tăng 12% so với 6 tháng đầu năm 2020.\nViệc đưa vào sản phẩm thương hiệu mới đã giúp Pymepharco (PME) ghi nhận mức doanh thu thuần khâu bán hàng tăng gần 46% so với cùng kỳ. Sau khi khấu trừ chi phí, doanh nghiệp ghi nhận LNST quý 2 đạt 78 tỷ đồng, lũy kế 6 tháng báo lãi ròng 168 tỷ đồng, tăng 20%.\nTại Traphaco (TRA), chính sách bán hàng trong quý 2 được khách hàng ủng hộ nên doanh thu tăng mạnh. Bên cạnh đó, công ty tập trung các chương trình thúc đẩy bán các sản phẩm truyền thống của công ty nên có biên lợi nhuận tốt dẫn đến tỷ lệ chi phí giá vốn bán hàng giảm so với cùng kỳ. Kết quả, riêng quý 2 ghi nhận mức lãi ròng 63 tỷ đồng, bật tăng đến 48% so với quý 2/2020. Sau 6 tháng đầu năm 2021, lợi nhuận sau thuế theo đó đạt 124 tỷ đồng, tăng 37% so với nửa đầu năm 2020 đồng thời hoàn thành 52% kế hoạch đề ra.\nĐáng chú ý trong nhóm doanh nghiệp vừa và nhỏ, Pharbaco (PBC) ghi nhận tình hình kinh doanh khởi sắc khi lãi ròng chỉ trong nửa đầu năm đã gấp gần 3 lần mục tiêu đề ra cho cả năm 2021. Theo đó Pharbaco báo lãi ròng quý 2 hơn 12 tỷ đồng, tăng 124% so với cùng kỳ. Lũy kế 6 tháng đầu năm, Pharbaco đạt 26,6 tỷ đồng, tăng 291% so với cùng kỳ - đánh dấu lần đầu tiên công ty vượt kế hoạch năm kể từ khi bắt đầu hoạt động.\nTuy vậy, không hẳn doanh nghiệp nào cũng ghi nhận kết quả tích cực khi vậy. Trái chiều với sự khởi sắc của các doanh nghiệp kể trên, Imexpharm – doanh nghiệp hoạt động chủ yếu dựa trên kênh ETC – ghi nhận sự đi ngang trong kinh doanh. Doanh thu quý 2 tăng nhẹ 8% lên mức 321 tỷ đồng, song chi phí giá vốn và chi phí bán hàng tăng mạnh khiến lãi ròng chỉ tăng 4% so với cùng kỳ, chỉ đạt hơn 49 tỷ đồng. Lũy kế nửa đầu năm 2021, Imexpharm báo lãi ròng sau thuế 91 tỉ đồng, tăng hơn 3% so với cùng kỳ năm ngoái.\nThậm chí tại Dược phẩm OPC (OPC), kết quả kinh doanh đi lùi tới 2 chữ số khi quý 2 giảm 20% lợi nhuận so với cùng kỳ do chi phí tăng cao. Doanh thu đi ngang kèm theo áp lực từ các khoản mục chi phí, trong đó chi phí QLDN tăng hơn 41% đã khiến lãi ròng của công ty bị bào mòn chỉ còn xấp xỉ 17 tỷ đồng.\nTương tự, Hóa - Dược phẩm Mekophar (MKP) trong quý 2 chỉ ghi nhận mức lãi ròng nhỏ giọt chỉ vỏn vẹn 2,2 tỷ đồng, giảm tới 39% so với quý 2/2020. Cùng chịu áp lực tăng chi phí, đặc biệt là giá vốn khiến kinh doanh của Mekophar vô cùng khó khăn. Lũy kế 6 tháng đầu năm, doanh thu thuần của MKP đạt 519 tỷ đồng, giảm 19%; theo đó lợi nhuận sau thuế chỉ hơn 11 tỷ đồng, giảm đi gần một nửa so với khoản lãi thu được trong 6 tháng đầu năm 2020, đồng thời mới hoàn thành 20% kế hoạch lợi nhuận năm.\nThực tế, cổ phiếu ngành dược được xem là một trong những cổ phiếu thuộc dạng ""phòng thủ"" và khá được ưa chuộng trong bối cảnh thị trường chứng khoán điều chỉnh mạnh với mức tăng trưởng ổn định. Theo Fitch Solutions, ngành dược phẩm Việt Nam trong năm 2021 sẽ phục hồi và dự kiến tăng trưởng 8,7%, thấp hơn so với giai đoạn 2010-2019.\nTuy vậy, về ngắn hạn, ngành dược Việt Nam sẽ khó có sự đột phá vì nguồn nguyên liệu sản xuất phụ thuộc đến 90% vào nhập khẩu, Trung Quốc và Ấn Độ chiếm hơn 80% nguồn cung. Những diễn biến khó lường của COVID-19 sẽ vẫn tác động lớn tới việc nhập khẩu khiến nguồn cung tiếp tục là vấn đề lớn cho các doanh nghiệp.']"
11,['Gas Shipping (GSP) chào bán 20 triệu cổ phiếu huy động vốn mua thêm tàu chở dầu'],"['CTCP Vận tải sản phẩm khí Quốc tế (Gas Shipping – mã chứng khoán GSP) công bố bản cáo bạch chào bán cổ phiếu ra công chúng.\nTheo đó Gas Shipping dự kiến phát hành 20 triệu cổ phiếu chào bán cho cổ đông hiện hữu nhằm tăng vốn điều lệ, huy động vốn mua tàu chở dầu theo kế hoạch. Giá chào bán được xác định 10.000 đồng/cổ phiếu, tương ứng tổng số tiền dự kiến huy động 200 tỷ đồng. Tỷ lệ phát hành 55,6%, tương ứng tỷ lệ thực hiện quyền 9:5. Trên thị trường cổ phiếu GSP hiện giao dịch quanh mức 12.150 đồng/cổ phiếu.\nGas Shipping cho biết, mục đích chào bán cổ phiếu lần này nhằm huy động vốn bổ sung cho việc mua tàu phục vụ hoạt động sản xuất kinh doanh của công ty. Việc tăng vốn điều lệ có thể nâng cao năng lực tài chính và khả năng cạnh tranh của công ty trên thị trường, đồng thời giảm gánh nặng chi phí tài chính, nâng cao hiệu quả hoạt động.\nTrước đó Gas Shipping công bố kết quả kinh doanh 6 tháng đầu năm 2021 với doanh thu đạt 888 tỷ đồng, tăng 30% so với cùng kỳ. Và lợi nhuận sau thuế đạt hơn 30 tỷ đồng, tăng 7% và hoàn thành 58% chỉ tiêu lợi nhuận được giao cho cả năm.\nBáo cáo cho biết 6 tháng đầu năm đội GSP vận chuyển được 522 chuyến hàng với tổng khối lượng vận chuyển khoảng 588.339 tấn LPG. Mặt khác, tháng 3/2021, Công ty cũng làm đầu mối thực hiện 1 chuyến tàu lạnh VLGC để vận chuyển hàng nhập khẩu LPG từ Trung Đông về Vũng Tàu cho PV Gas Trading. Về dịch vụ vận tải LPG đường bộ bằng xe bồn, trong kỳ GSP tiếp tục duy trì Hợp đồng cho thuê TC 2 xe bồn của Công ty, đồng thời phát triển công tác thị trường cho các hợp đồng từ Dung Quất đi các khu vực miền Trung, dự kiến đến cuối năm sẽ đạt 700-1.000 MT/tháng.\nGas Shipping (GSP): Nửa đầu năm thực hiện được 58% chỉ tiêu LNST với 30 tỷ đồng']"
12,"['HDI Global SE đã bán xong 14 triệu cổ phiếu PVI, thu về gần 500 tỷ đồng']","['HDI Global SE vừa thông báo đã hoàn tất bán ra 14.054.512 cổ phiếu PVI, giảm lượng sở hữu sau giao dịch xuống còn 80.510.809 cổ phiếu (tỷ lệ 36,02%). Giao dịch thực hiện ngày 6/8/2021.\nHDI Global cũng kèm báo cáo sở hữu của các bên liên quan, trong đó hiện Funderburk Lightouse Limited đang sở hữu 26.994.995 cổ phiếu PVI (tỷ lệ 12,08%). Như vậy, sau khi bán bớt hơn 14 triệu cổ phiếu, HDI Global và quỹ liên quan giảm tổng lượng sở hữu cổ phiếu PVI từ 121,56 triệu cổ phiếu (tỷ lệ 54,38%) xuống còn hơn 107,5 triệu cổ phiếu (tỷ lệ 48,1%).\nTrước đó HDI Global đăng ký bán hơn 14 triệu cổ phiếu PVI từ 6/8 đến 1/9/2021 – như vậy HDI đã bán xong số cổ phiếu đăng ký ngay ngày giao dịch đầu tiên. Cũng trong ngày 6/8, có giao dịch thỏa thuận đúng số cổ phiếu HDI Global bán ra với giá bình quân 35.000 đồng/cổ phiếu, tương ứng tổng giá trị giao dịch gần 492 tỷ đồng. Giá 35.000 đồng/cổ phiếu còn thấp hơn rất nhiều so với giá đóng cửa cổ phiếu PVI cùng phiên ngày 6/8/2021 là 38.500 đồng/cổ phiếu.\nADVERTISING\niTVC from Admicro\nĐộng thái mua-bán cổ phiếu PVI liên tục của HDI Global thời gian gần đây đang khiến các nhà đầu tư chú ý. Trước đó HDI Global SE bị UBCKNN phạt vi phạm hành chính với các lỗi liên quan đến việc quỹ này đã thực hiện một hoặc một số giao dịch nhằm che giấu quyền sở hữu thực sự đối với cổ phiếu PVI để trốn tránh nghĩa vụ công bố thông tin. Đồng thời HDI Global SE đã vi phạm tỷ lệ nắm giữ chứng khoán của nhà đầu tư nước ngoài đối với cổ phiếu PVI.\nCùng với hình phạt về tiền với tổng số tiền 185 triệu đồng, UBCKNN còn quy định HDI Global SE ""buộc phải chuyển nhượng cổ phiếu trong thời hạn tối đa 60 ngày để giảm tỷ lệ nắm giữ theo đúng quy định"". Và quỹ này đã thực hiện chuyển nhượng bớt 13,8 triệu cổ phiếu.\nNgay sau khi chuyển nhượng bớt 13,8 triệu cổ phiếu, HDI Global đã thực hiện ngay động thái cho hơn 345 tỷ đồng mua lại 9,22 triệu cổ phiếu PVI ở mức giá bình quân 37.444 đồng/cổ phiếu. Giao dịch thực hiện từ 20/7 đến 21/7/2021.\nĐối với hoạt động bán ra lần này của HDI Global, đối tác mua vào là Công Ty Tài Chính Quốc Tế (IFC). Trước đó HDI Global và IFC đã ký kết một thỏa thuận đối tác chiến lược nhằm đẩy mạnh hơn nữa sự phát triển của PVI.\nHDI Global SE lại đăng ký bán bớt 14 triệu cổ phiếu PVI']"
13,['Vinamilk sắp chi hơn 3.100 tỷ đồng tạm ứng cổ tức đợt 1/2021 cho cổ đông'],"['Ngày 8/9 tới đây CTCP Sữa Việt Nam (Vinamilk – mã chứng khoán VNM) sẽ chốt danh sách cổ đông chi tạm ứng cổ tức đợt 1/2021 bằng tiền cho cổ đông. Tỷ lệ chi trả 15%, tương ứng cổ đông sở hữu 1 cổ phiếu được nhận về 1.500 đồng. Thời gian thanh toán 30/9/2021.\nNhư vậy với gần 2,09 tỷ cổ phiếu đang niêm yết và lưu hành, dự kiến Vinamilk sẽ chi khoảng 3.135 tỷ đồng trả cổ tức đợt này cho cổ đông.\nTrước đó Vinamilk đã công bố kết quả kinh doanh 6 tháng đầu năm 2021 với doanh thu giảm 2,5% so với cùng kỳ, còn 28.906 tỷ đồng. Lợi nhuận sau thuế giảm sút 6,9% xuống còn 5.459 tỷ đồng, trong đó lợi nhuận sau thuế thuộc về cổ đông công tymej đạt 5.410 tỷ đồng.\nTính đến 30/6/2021 Vinamilk còn 6.631 tỷ đồng lợi nhuận sau thuế chưa phân phối. Ngoài ra công ty còn 3.844 tỷ đồng trong quỹ đầu tư phát triển, 202 tỷ đồng vốn khác của chủ sở hữu và 34 tỷ đồng thặng dư vốn cổ phần.\nVinamilk (VNM) lãi sau thuế 2.862 tỷ đồng trong quý 2, nâng tổng lãi 6 tháng lên gần 5.460 tỷ đồng']"
14,"['Kinh Bắc (KBC): Quý 2 lãi 71 tỷ đồng, giảm sâu so với quý đầu năm 2021']","['Tổng công ty Phát triển Đô thị Kinh Bắc - CTCP (Mã CK: KBC) đã công bố BCTC quý 2/2021 và luỹ kế 6 tháng đầu năm 2021.\nTheo đó, riêng quý 2/2021, doanh thu thuần đạt 750 tỷ đồng, sau khi trừ giá vốn lợi nhuận gộp đạt 448 tỷ đồng tăng tới 296% so với quý 2/2020.\nTrong kỳ chi phí tài chính và chi phí QLDN lần lượt tăng thêm 230% và 212%, nhờ lãi gộp ở mức cao nên sau khi trừ các khoản chi phí lợi nhuận sau thuế đạt 70,6 tỷ đồng tăng cao gấp 6,4 lần so với cùng kỳ năm trước. LNST công ty mẹ là 34,4 tỷ đồng trong khi cùng kỳ lỗ gần 3 tỷ đồng.\nTheo giải trình từ phía công ty nguyên nhân lợi nhuận quý 2/2021 tăng đột biến là do công ty tăng ghi nhận doanh thu từ hợp đồng cho thuê đất khu công nghiệp và đô thị.\nMặc dù doanh thu và lợi nhuận quý 2/2021 tăng cao so với cùng kỳ tuy nhiên so với 2 quý gần đây thì lại thấp hơn đáng kể.\nLũy kế 6 tháng đầu năm 2021, KBC ghi nhận doanh thu thuần đạt 2.752 tỷ đồng, lợi nhuận sau thuế đạt 785 tỷ đồng, lần lượt tăng 278% và 647% so với cùng kỳ năm trước.\nADVERTISING\niTVC from Admicro\nNăm 2021, KBC đặt kế hoạch kinh doanh với tổng doanh thu là 6.600 tỷ đồng, lợi nhuận sau thuế là 2.000 tỷ đồng. \nNhư vậy, mặc dù doanh thu và lợi nhuận sau 6 tháng đầu năm 2021 tăng cao nhưng KBC cũng mới chỉ hoàn thành được các chỉ tiêu kinh doanh ở mức thấp với 42% mục tiêu về doanh thu và 39% mục tiêu về lợi nhuận.\nTính tới 30/6/2021, tổng tài sản của KBC tăng 16,6% so với đầu năm lên 27.732 tỷ đồng. Trong đó, tài sản chủ yếu là tồn kho đạt 11.623 tỷ đồng, chiếm 42% tổng tài sản, tập trung lớn nhất là ở dự án KCN và KĐT Tràng Cát (7.270 tỷ đồng).\nTrong kỳ, các khoản phải thu ngắn hạn tăng 30,1% so với đầu năm, tương ứng tăng thêm 1.997 tỷ đồng lên 8.635 tỷ đồng. Trong đó, đáng chú ý khoản mục phải thu khác về cho vay ngắn hạn tăng đột biến từ 925 tỷ đồng lên 1.822 tỷ đồng.\nNgoài ra, trong kỳ tổng nợ vay ngắn hạn và dài hạn tăng 30% so với đầu năm, tương ứng tăng thêm 1.726 tỷ đồng lên 7.491 tỷ đồng và chiếm 27% tổng nguồn vốn.']"
15,"['Đơn hàng nhiều, doanh nghiệp dệt may đồng loạt lãi cao trong nửa đầu năm 2021']","['Đơn hàng dồi dào giúp doanh thu khởi sắc\nThị trường dệt may nửa đầu năm nay, nhìn chung đã khởi sắc trở lại khi xuất khẩu tăng hơn 15% so với cùng kỳ năm 2020. Bộ Công Thương đánh giá, một số thị trường xuất khẩu chính như Mỹ, châu Âu tăng nhu cầu mua sắm quần áo, giày dép khi kinh tế bắt đầu hồi phục, các lệnh giãn cách xã hội được gỡ bỏ nhờ đẩy nhanh chiến dịch tiêm vaccine phòng Covid-19.\nNhớ lại thời điểm này năm ngoái, khi đợt dịch thứ 2 bùng phát, các doanh nghiệp dệt may trong tình trạng đối tác liên tục hoãn, hủy đơn hàng. Năm nay, hầu hết các doanh nghiệp đều có đơn hàng sản xuất tới hết năm.\nTrên sàn niêm yết các doanh nghiệp dệt may công bố KQKD nửa đầu năm ấn tượng với doanh thu đều tăng trưởng so với cùng kỳ.\nTheo đó về doanh thu đa phần các doanh nghiệp dệt may có mức tăng trưởng doanh thu 2 con số trong đó TNG và GIL có mức tăng trưởng doanh thu tốt nhất đạt 29 – 30%.\nTNG cho biết ngay từ đầu năm công ty đã định hướng được việc tập trung vào khai thác, tăng tỷ trọng các khách hàng FOB chủ đạo cùng với việc khách hàng dịch chuyển đơn hàng từ các nước bị ảnh hưởng bởi dịch bệnh sang Việt Nam. Trong cơ cấu doanh thu, hàng FOB tăng 73% so với cùng kỳ.\nTrong khi đó GIL là một trong những công ty ở Việt Nam phục vụ được một trong những khách hàng khó tính trên thế giới như Amazon, Ikea… Công ty sẽ tiếp tục duy trì đơn hàng với các khách hàng lớn. Nhờ thay đổi cơ cấu mặt hàng xuất bán trong kỳ mà GIL có mức doanh thu tăng trưởng cao trong nửa đầu năm nay.\nTiếp đó Sợi Thế Kỷ, Hanosimex và KMR cũng lần lượt có mức tăng trưởng doanh thu đạt 24%, 23% và 21%.\nỞ chiều ngược lại May 10, May Nhà Bè và Dệt Phong Phú có mức doanh thu sụt giảm so với cùng kỳ trong đó May 10 đạt doanh thu thuần gần 1433 tỷ đồng, giảm 20% so với thực hiện trong nửa đầu năm trước.\nTrước đó lo ngại thiếu hụt lao động, May Nhà Bè (MNB) đặt kế hoạch năm 2021 sụt giảm 2 con số. Công ty cho biết các đơn hàng giảm đột ngột, đặc biệt là chủng loại veston, sơ mi cao cấp vốn là sản phẩm chiến lược truyền thống mang lại giá trị cao cho May Nhà Bè, đều sụt giảm đáng kể. Để thích ứng với tình hình thực tế, doanh nghiệp này nói riêng buộc phải chuyển đổi sản xuất các chủng loại khẩu trang, sản phẩm bảo hộ y tế, quần áo thể thao,…\nLợi nhuận tăng trưởng tới 3 con số\nNhờ doanh thu khởi sắc và tiết kiệm chi phí mà hàng loạt doanh nghiệp dệt may có lợi nhuận tăng trưởng rất cao trong nửa đầu năm 2021. Trong đó có nhiều doanh nghiệp có lợi nhuận tăng trưởng gấp nhiều lần so với cùng kỳ như KMR sau khi chỉ lãi thấp trong nửa đầu năm ngoái năm nay có lãi 12,4 tỷ đồng cao gấp 62 lần cùng kỳ.\nĐáng chú ý ông lớn Vinatex (VGT) sau khi gặp khó trong quý 1 thì sang quý 2 các đơn hàng phục hồi cả về số lượng lẫn giá bán đặc biệt khủng hoảng chính trị Myanmar cùng với làn sóng dịch dịch bệnh bùng phát tại Ấn Độ, Bangladesh đã khiến nhiều hãng thời trang trên thế giới dịch chuyển sản xuất qua Việt Nam, đơn hàng dồi dào giúp nâng cao hiệu quả của doanh nghiệp. Kết quả VGT lãi sau thuế nửa đầu năm đạt 591 tỷ đồng, gấp 2,2 lần so với nửa đầu năm 2020, LNST thuộc về công ty mẹ là 292 tỷ đồng.\nTiếp đó là mức tăng trưởng lợi nhuận ấn tượng của May Việt Tiến (VGG) đạt 70 tỷ đồng LNST tăng 117%, Sợi Thế Kỷ (STK) tăng 156% hay Hanosimex (HSM) tăng cao gấp hơn 3 lần cùng kỳ. EVE cũng chuyển từ lỗ snag có lãi 9 tỷ đồng trong nửa đầu năm 2021.\nỞ chiều ngược lại cá biệt có trường hợp của May Nhà Bè (MNB), doanh nghiệp này không chỉ có mức doanh thu sụt giảm mạnh mà còn báo lỗ 31 tỷ đồng cao gấp 2 lần so với mức lỗ cùng kỳ. Doanh nghiệp này cho biết nguyên nhân thua lỗ là do ảnh hưởng của đại dịch Covid – 19 tại Việt Nam và toàn thế giới, đặc biệt là tại Châu Âu, Châu Mỹ, Châu Á đồng thời cũng là thị trường xuất khẩu chủ lực của MNB và các công ty con, côn ty liên doanh liên kết.\nThách thức trong nửa cuối năm 2021\nVới kết quả kinh doanh ấn tượng trong nửa đầu năm nay đã giúp các doanh nghiệp dệt may có tỷ lệ hoàn thành kế hoạch năm 2021 ở mức cao trong đó có Gillimex (GIL) đã vượt kế hoạch đề ra cho cả năm, Vinatex và Dệt Phong Phú có tỷ lệ hoàn thành kế hoạch lần lượt là 84% và 95%.\nThời điểm này, mặc dù nhiều doanh nghiệp dệt may liên tục nhận đơn hàng mới, nhưng trong bối cảnh dịch Covid-19 vẫn diễn biến phức tạp tại nhiều địa phương, nguy cơ thiếu hụt lao động và chậm tiến độ giao trả hàng, ngành dệt may đang phải đối mặt với nhiều thách thức trong những tháng cuối năm.\nTheo đó nhiều doanh nghiệp trong ngành cho rằng tiêm vaccine phòng COVID-19 là giải pháp hữu hiệu để giữ chân người lao động.']"
16,"['HAGL Agrico (HNG): Nửa đầu năm lỗ ròng 123 tỷ đồng, dư nợ tại Thaco chiếm đến 47% tổng tài sản với 7.359 tỷ đồng']","['HAGL Agrico (HNG) vừa công bố BCTC hợp nhất quý 2/2021 với doanh thu thuần hơn 252 tỷ đồng, giảm phân nửa so với cùng kỳ năm 2020. Khấu trừ giá vốn, Công ty chỉ còn lãi khoảng 18 tỷ đồng, giảm mạnh so với mức 132 tỷ hồi quý 2/202.\nVề hoạt động tài chính, doanh thu tăng đáng kể. Chi phí lãi vay cũng tăng từ mức 109 tỷ (quý 2/2020) lên gần 121 tỷ đồng. Đặc biệt, do không còn phát sinh khoản hoàn nhập như cùng kỳ năm 2020, khiến chi phí ghi nhận tăng mạnh.\nKhấu trừ chi phí, HNG lỗ ròng hơn 129 tỷ đồng, cùng kỳ lãi hơn 9 tỷ.\nGiải trình, HNG cho biết:\n+ Do ảnh hưởng của dịch bệnh Covid-19 đã làm giá mua vật tư nông nghiệp, bao bì đóng gói và chi phí vận chuyển bằng đường biển tăng so với quý 1/2021.\n+ Chi phí nhân công cũng tăng do ảnh hưởng Covid-19 dẫn đến nguồn lao động địa phương bị hạn chế do quy định giãn cách xã hội tại các địa phương có dự án. Chi phí phát sinh cho lao động người Việt tăng cao từ quý 2/2021 do quy định về cách ly và kiểm tra phòng ngừa Covid-19 tăng tại cửa khẩu.\n+ Tại thời điểm 30/6/20201, Công ty có thực hiện trích lập dự phòng một số khoản phải thu là 43 tỷ đồng, thanh lý hàng tồn kho trái cây chế biến (IQF) đã sản xuất từ năm 2019.\n+ Mặt khác, sản lượng và doanh thu chưa tăng như kỳ vọng do các vườn cây chuối, dứa, xoài đang trong giai đoạn cải tạo và khắc phục tình trạng thiếu nước, thiếu điện, thiếu phân bón từ cuối năm 2020 chuyển sang,đồng thời năng suất và chất lượng không thể cải thiện trong thời gian ngắn.\nLuỹ kế nửa đầu năm, HNG đạt 512 tỷ doanh thu, giảm 56% so với cùng kỳ. Khấu trừ, Công ty lỗ ròng gần 123 tỷ đồng, nửa đầu năm 2020 lãi hơn 11 tỷ đồng.\nTheo đó, lỗ luỹ kế của HNG tính đến thời điểm 30/6/2021 vào mức 2.429 tỷ đồng. Đây là quý thứ 2 sau khi bầu Đức rút lui khỏi HNG và nhường lại cho Thaco cầm lái.\nDư nợ với Thaco hiện vào mức 7.359 tỷ đồng – tương đương 47% tổng tài sản HNG\nDù phía Thaco vừa có quyết định dừng không mua thêm cổ phần HNG để hoán đổi nợ như kế hoạch trước đó, nhóm Thaco vẫn đang nắm cổ phần kiểm soát tại HNG với tổng sở hữu là 38,38%. Ngược lại, nhóm cổ đông HAG đã dần hạ tỷ trọng tại HNG, hiện về mức 16,34% vốn.\nTheo Nghị quyết ngày 31/7 vừa qua, HNG sẽ thực hiện cấn trừ công nợ số tiền chuyển nhượng 4 công ty con với khoản tiền HNG nợ Thaco. Dự kiến sau cấn trừ, tổng nợ HNG phải trả cho Thaco còn 7.359 tỷ đồng, chiếm 47% tổng tài sản Công ty.\nQuý 3 dự đạt 353 tỷ doanh thu, gấp rút hoành thành và bàn giao sân bay NongKhang cho Lào\nLên kế hoạch cho quý 3/2021, HNG dự kiến sản lượng trái cây đạt 24.586 tấn, tăng 40% so với quý 2/2021. Trong đó, chuối đạt 22.453 tấn, dứa 165 tấn. Cùng với đó, HNG dự kiến khai thác 1.500 ha mủ cao su. Tổng doanh thu theo đó dự đạt 353 tỷ đồng.\nĐể đạt được những chỉ tiêu trên, HNG chủ trương tập trung đầu tư mới hệ thống thủy lợi gồm hệ thống hố thu và trạm bơm chính, hồ chứa nước trung gian và hồ tưới để chuẩn bị phục vụ mùa khô năm 2022. Song song, Công ty cũng lên kế hoạch đầu tư mới và nâng cấp hệ thống điện, đường dây trung thế, xây dựng đê để ngăn lũ...\nPhía HNG cũng thông tin thêm, hiện tiến độ dự án sân bay NongKhang đã hoàn thành 92,34%, tuy nhiên do thực tế phát sinh một số khối lượng vông việc so với hợp đồng và do dịch Covid-19 dẫn đến tiến độ chậm hơn so với dự kiến. Công ty cho biết sẽ gấp rút phối hợp với các nhà thầu để sớm hoàn tất dự án và tiến hành bàn giao cho Chính phủ Lào.']"
